"","PMID","Title","Abstract"
"15","21820452","Susceptibility to the long-term anxiogenic effects of an acute stressor is mediated by the activation of the glucocorticoid receptors.","The specificity of the response of an organism is an important variable influencing stress-related parameters and psychopathological states. We have shown that trait anxiety in C57BL/6 mice  determined by their emergence latencies in the free choice open field test  positively correlates with the long-term behavioral and neuroendocrinological changes induced by a stressor. Here  we show that this interindividual variability is caused by a different reactivity of the hypothalamus-pituitary-adrenal (HPA) axis upon exposure to a stressor. Mice with high trait anxiety (long emergence latency  LEL) display a more pronounced stress-induced activation of the HPA axis than mice with low trait anxiety (short emergence latency  SEL). Moreover  stress-induced activation of tyrosine hydroxylase and corticotropin-releasing hormone occurred in LEL but not SEL mice. In search of the molecular mechanisms underlying these differences  we found that under non-stressed conditions mRNA and protein levels of the glucocorticoid receptor in the hippocampus were higher in LEL mice compared to SEL mice. Also  systemic injection of the glucocorticoid receptor antagonist RU486 decreased the stress-induced activation of the HPA axis and the long-term anxiogenic effects of stress observed in LEL mice. Finally  the rewarding properties of cocaine were enhanced in LEL mice compared to SEL mice  suggesting a causal link between trait anxiety  stress activity and the behavioral responses to drugs of addiction."
"16","21333660","Characterization of 5-HT(1A/1B)-/- mice: an animal model sensitive to anxiolytic treatments.","Selective serotonin (5-HT) re-uptake inhibitors (SSRIs) are commonly used in the treatment of generalized anxiety disorder in Humans. However  because only few animal models display overt anxious-like behavior  detailed preclinical studies of the anxiolytic properties of antidepressants are still lacking. Here  we studied the neurochemical and behavioral effects of a double 5-HT(1A/1B) receptor knockout in mice (5-HT(1A/1B)-/-) as compared to their wild-type littermates (5-HT(1A/1B)+/+). It is known that single deletion of either 5-HT(1A) or 5-HT(1B) receptor induces behavioral changes that are not correlated with differences in brain serotonergic tone. Deletion of both receptors resulted in (i) higher emotionality of animals  as observed in three unconditioned paradigms of anxiety (open field  elevated plus maze and novelty suppressed feeding tests); (ii) a ˜200% increase in the mean spontaneous firing rate of 5-HT neurons in the dorsal raphe nucleus (DRN) compared to 5-HT(1A/1B)+/+ mice; (iii) elevated basal dialysate levels of 5-HT in the DRN and frontal cortex; (iv) an exaggerated response to acute paroxetine administration in microdialysis experiments  and (v) increased basal core body temperature. These findings suggest that the deletion of both autoreceptors induces a strong anxious-like behavioral state associated with increased 5-HT neurotransmission. Interestingly  5-HT(1A/1B)-/- mice are still sensitive to the acute administration of diazepam. Moreover  while deletion of both receptors impacted on the response to acute SSRI treatment in the forced swim test  anxiolytic-like effects of a chronic SSRI treatment were still observed in 5-HT(1A/1B)-/- mice. Thus  the 5-HT(1A/1B)-/- mouse model could be of great interest to unveil the mechanisms of action of the anxiolytic effects of SSRIs."
"17","20678516","Pharmacological evaluation of a novel assay for detecting glycine transporter 1 inhibitors and their antipsychotic potential.","Multiple lines of evidence support the notion that hypofunction of glutamatergic neurotransmission is involved in the pathophysiology of schizophrenia. Moreover  glycine and glycine modulators have beneficial effects in patients with schizophrenia  particularly when added on to existing therapy. As glycine is an obligatory co-agonist at the NR1 subunit of the NMDA receptor  blockade of glycine uptake at the glycine transporter type-1 (GlyT1) can enhance low glutamatergic tone. L-687 414 is an antagonist at the glycine modulatory site of the NMDA complex and  behaviorally  increases locomotion. A series of GlyT1 inhibitors along with other psychoactive compounds were examined for their ability to enhance or inhibit the action of L-687 414. GlyT1 inhibitors and the other compounds were examined initially for effects on [(3)H]-glycine uptake in CHO cells expressing hGlyT1b cDNA and for their ability to displace the NMDA-glycine site ligand [(3)H]-L-689 560 from isolated rat forebrain membrane preparations. The in vivo activity of these compounds was determined in mice by measuring their ability to prevent L-687 414-induced hyperlocomotion. GlyT1 inhibitors blocked [(3)H]-glycine uptake in cells expressing the human transporter; other compounds had little or no activity. None of the compounds had affinity for the glycine site of the NMDA receptor complex. Hyperlocomotion induced by L-687 414 was dose-dependently reduced by GlyT1 inhibitors and antipsychotic drugs but not by morphine  fluoxetine or a moderate dose of diazepam. Therefore  this behavioral approach can reliably detect GlyT1 inhibitors which  in turn  may have some activity in common with drugs having antipsychotic effects."
"18","20160205","Psychopharmacological neuroprotection in neurodegenerative disease: assessing the preclinical data.","This manuscript reviews the preclinical in vitro  ex vivo  and nonhuman in vivo effects of psychopharmacological agents in clinical use on cell physiology with a view toward identifying agents with neuroprotective properties in neurodegenerative disease. These agents are routinely used in the symptomatic treatment of neurodegenerative disease. Each agent is reviewed in terms of its effects on pathogenic proteins  proteasomal function  mitochondrial viability  mitochondrial function and metabolism  mitochondrial permeability transition pore development  cellular viability  and apoptosis. Effects on the metabolism of the neurodegenerative disease pathogenic proteins alpha-synuclein  beta-amyloid  and tau  including tau phosphorylation  are particularly addressed  with application to Alzheimer's and Parkinson's diseases. Limitations of the current data are detailed and predictive criteria for translational clinical neuroprotection are proposed and discussed. Drugs that warrant further study for neuroprotection in neurodegenerative disease include pramipexole  thioridazine  risperidone  olanzapine  quetiapine  lithium  valproate  desipramine  maprotiline  fluoxetine  buspirone  clonazepam  diphenhydramine  and melatonin. Those with multiple neuroprotective mechanisms include pramipexole  thioridazine  olanzapine  quetiapine  lithium  valproate  desipramine  maprotiline  clonazepam  and melatonin. Those best viewed circumspectly in neurodegenerative disease until clinical disease course outcomes data become available  include several antipsychotics  lithium  oxcarbazepine  valproate  several tricyclic antidepressants  certain SSRIs  diazepam  and possibly diphenhydramine. A search for clinical studies of neuroprotection revealed only a single study demonstrating putatively positive results for ropinirole. An agenda for research on potentially neuroprotective agent is provided."
"19","19251245","Co-treatment with diazepam prevents the effects of fluoxetine on the proliferation and survival of hippocampal dentate granule cells.","BACKGROUND: Selective serotonin reuptake inhibitors (SSRI) often produce increased anxiety during the first weeks of treatment before the clinical antidepressant response  and these symptoms are commonly treated with benzodiazepines. Selective serotonin reuptake inhibitors increase proliferation of neuronal progenitors in rodent hippocampus after a delay of approximately 2 weeks.METHODS: We have used this delayed increase in neurogenesis  as detected with both a rapid dot-blot method and with immunostaining  as a model of the delayed clinical antidepressant effects.RESULTS: Whereas the SSRI fluoxetine alone significantly increased both neurogenesis and survival of newborn cells when administered for 2-3 weeks  co-treatment with diazepam and fluoxetine completely blocked the increase in both neurogenesis and survival. Furthermore  neurogenesis was not increased when fluoxetine and diazepam were first co-administered for 2 weeks and then fluoxetine was given alone for 2 additional weeks. Moreover  we show that daily administration is necessary for neurogenesis  because injection of fluoxetine for up to 1 week failed to increase neurogenesis  when assayed at 14 days from the first injection.CONCLUSIONS: These results suggest that benzodiazepines might interfere with the clinical effects of fluoxetine or that increased neurogenesis is not a valid model for the delayed onset of the clinical antidepressant effects."
"20","18548231","Subnanomolar dopamine D3 receptor antagonism coupled to moderate D2 affinity results in favourable antipsychotic-like activity in rodent models: II. behavioural characterisation of RG-15.","RG-15 (trans-N-[4-[2-[4-(3-cyano-5-trifluoromethyl -phenyl) -piperazine -1 -yl] -ethyl] -cyclohexyl] -3 -pyridinesulfonic amide dihydro-chloride)  is a highly selective dopamine D3/D2 receptor antagonist with subnanomolar affinity for the D3 receptor and nanomolar affinity for the D2 receptor. We found that RG-15 showed a good oral bioavailability (54%) and high brain levels (approx. 900 ng/g) in rats and demonstrated antipsychotic efficacy in amphetamine-induced hyperactivity and conditioned avoidance response tests in rats  yielding ED50 (median effective dose) values of 8.6 and 12 mg/kg orally  respectively. At six- to eightfold higher doses  RG-15 blocked spontaneous motor activity  while a 30 mg/kg dose of the compound caused an increase in the home-cage motility of rats. The drug did not produce catalepsy up to 160 mg/kg oral dose; moreover  it inhibited haloperidol-induced catalepsy in the range 15-60 mg/kg. RG-15 (10 mg/kg orally) restored the impaired learning performance of scopolamine- or diazepam-treated rats in a water-labyrinth paradigm. It is assumed that the motor activating  anticataleptic and cognitive-enhancing properties of RG-15 result from its potent D3 antagonism. In this regard  RG 15 clearly differs from other antipsychotics. Olanzapine  clozapine and amisulpride all showed efficacy against amphetamine-induced hyperactivity and on conditioned avoidance  but compared to RG-15  they proved to be more cataleptogenic and depressed or did not change the home-cage activity of animals. Olanzapine was also inactive in the learning paradigm. Our results suggest that subnanomolar dopamine D3 receptor antagonism coupled to moderate D2 affinity may result in an antipsychotic profile characterised by a lack of extrapyramidal side effects and secondary negative symptoms with simultaneous efficacy on positive and cognitive symptoms of schizophrenia."
"21","18420937","The antidepressant fluoxetine restores plasticity in the adult visual cortex.","We investigated whether fluoxetine  a widely prescribed medication for treatment of depression  restores neuronal plasticity in the adult visual system of the rat. We found that chronic administration of fluoxetine reinstates ocular dominance plasticity in adulthood and promotes the recovery of visual functions in adult amblyopic animals  as tested electrophysiologically and behaviorally. These effects were accompanied by reduced intracortical inhibition and increased expression of brain-derived neurotrophic factor in the visual cortex. Cortical administration of diazepam prevented the effects induced by fluoxetine  indicating that the reduction of intracortical inhibition promotes visual cortical plasticity in the adult. Our results suggest a potential clinical application for fluoxetine in amblyopia as well as new mechanisms for the therapeutic effects of antidepressants and for the pathophysiology of mood disorders."
"22","17848146","Comparison of trazodone, diazepame and dibenzepine influences on rat brain beta-endorphins content.","The aim of our study was to establish the extent of influence of different psychotropic drugs to brain Beta-endorphins in experimental animals. The study was performed on albino Wistar rats (weight 250 g)  treated with different psychoactive drugs. RIA technique was employed for quantification of brain beta-endorphins. Brain beta-endorphins were higher in experiment group treated with trazodone (929 pg/g +/- 44 43; X+/-SD)  and dibenzepine (906 63 pg/g +/- 74 06)  yet with lower brain content in rats treated with diazepam (841 55 pg/g +/- 68 47)  compared to brain beta-endorphins content of control group treated with saline solution (0 95% NaCl) (873 5 pg/g +/- 44 89). Significant differences were obtained comparing brain beta-endorphins of trazodone vs. diazepam treated animals  with diazepam group having lower values (p&lt;0 02). This study showed differences in changes of rat brain beta-endorphins contents when different psychoactive drugs are used. Therefore  we consider that beta-endorphins could be used for evaluation of effects of psychoactive drugs  as a useful parameter in therapy with these psycho-pharmaceuticals."
"23","16307296","Effect of noradrenergic system on the anxiolytic-like effect of DOI (5-HT2A/2C agonists) in the four-plate test.","RATIONALE: Selective serotonin reuptake inhibitors and serotonin and noradrenaline reuptake inhibitors demonstrated an anxiolytic-like effect in the four-plate test (FPT). (+/-)-1-(2 5-Dimethoxy-4-iodophenyl)-2-aminopropane (DOI; a 5-HT2A receptor agonist) also possessed strong anxiolytic-like effect in the same test. A 5-HT2A mechanism seems to be implicated in the mechanism of action of both antidepressants and DOI in this test. On the other hand  the alpha-adrenergic ligands have also demonstrated an activity in other models of anxiety. A previous study demonstrated that the alpha2-adrenoceptor agonists abolished the anxiolytic-like effect of antidepressants.OBJECTIVES: The aim of the present study was to evaluate the role of noradrenergic system on the regulation of 5-HT2 receptors implicated in the DOI anxiolytic-like activity in the FPT.METHODS: First  the effect of noradrenergic and serotonergic lesions on DOI anxiolytic-like activity was studied in the FPT. Second  the effect of co-administration of alpha-adrenoceptor ligands and DOI was evaluated in the same test.RESULTS: The noradrenergic and serotonergic lesions had no effect on DOI (1 mg/kg) anti-punishment activity in the FPT. Adrafinil 0.25 and 4 mg/kg (an alpha1-adrenoceptor agonist)  prazosin 0.5 and 2 mg/kg (an alpha1-adrenoceptor antagonist) and idazoxan 1 and 4 mg/kg (an alpha2-adrenoceptor antagonist) did not modify the activity of DOI. Clonidine 0.06 mg/kg  guanabenz 0.125 and 0.5 mg/kg (two alpha2-adrenoceptor agonists) and guanfacine 0.06 and 0.125 mg/kg (a specific alpha2A-adrenoceptor agonist) completely abolished DOI-induced increase in punished passages.CONCLUSION: These results indicate that the DOI seems to act on the 5-HT2 receptors post-synaptically located. The effect of DOI is regulated by the alpha2-adrenoceptors."
"24","15100702","Role of neuroactive steroid allopregnanolone in antipsychotic-like action of olanzapine in rodents.","Olanzapine increases brain allopregnanolone (ALLO) levels sufficiently to modulate neuronal activity by allosterically regulating GABAA receptors. Recently  we reported the antipsychotic-like profile of ALLO in rodents. The present study examined the hypothesis that olanzapine-induced elevation of endogenous neurosteroid ALLO is vital for its neuroleptic-like action. The conditioned avoidance response (CAR) and apomorphine-induced climbing behavioral paradigms were used in rodents. Administration of ALLO (1 microg  intracerebroventricular (i.c.v.)) or neurosteroidogenic agents such as the mitochondrial diazepam binding inhibitor receptor agonist  FGIN 1-27 (0.5 microg  i.c.v.) or the ALLO precursor  progesterone (10 mg/kg  i.p.) significantly potentiated olanzapine-induced blockade of CAR and apomorphine-induced climbing. In contrast  these agents failed to alter the antipsychotic-like effect of risperidone and haloperidol. On the other hand  inhibition of the endogenous biosynthesis of neurosteroids by the 3beta-hydroxysteroid dehydrogenase inhibitor  trilostane (30 mg/kg  i.p.)  the 3alpha-hydroxysteroid oxidoreductase inhibitor  indomethacin (5 mg/kg  i.p.)  or the GABAA receptor antagonist bicuculline (1 mg/kg  i.p.) and dehydroepiandrosterone sulfate (DHEAS) (1 mg/kg  i.p.) blocked the effect of olanzapine  but not of risperidone and haloperidol. Socially isolated animals  known to exhibit decreased brain ALLO and GABAA receptor functions  displayed a shortening in the muscimol-induced loss of righting reflex and an increased susceptibility to apomorphine-induced climbing. Administration of olanzapine  but not of haloperidol and risperidone  normalized the duration of muscimol-elicited loss of righting reflex. Although all three antipsychotics proved capable of antagonizing the apomorphine-induced climbing  a dose almost five times higher of olanzapine was required in socially isolated animals. The data obtained suggest that enhancement of the GABAergic tone plays a key role in the antipsychotic-like effect exerted by olanzapine in rodents  likely as a consequence of augmented levels of neuroactive steroids  in particular ALLO  in the brain. The present findings provide the first specific behavioral evidence in support of the hypothesis that neuroactive steroid ALLO- mediated GABAergic modulation is essential for the antipsychotic-like action of olanzapine."
"25","14531941","Cytoprotective effect is one of common action pathways for antidepressants.","AIM: To explore the possible common action mechanism of antidepressants.METHODS: The cell viability was detected by MTT assay. The intracellular Ca2+ concentration ([Ca2+]i) was measured by Fura 2-AM fluorescence labeling assay. Using RT-PCR  the mRNA level of nerve growth factor (NGF) was also detected.RESULTS: High concentration of corticosterone (0.2 mmol/L) was incubated with PC12 cells to simulate the lesion state of brain neurons in depressive illness. Three main kinds of antidepressants used in clinic [(1) tricyclic antidepressants (TCAs)  such as desipramine (DIM) 0.625-10 micromol/L; (2) selective serotonin reuptake inhibitors (SSRIs)  such as fluoxetine (FLU) 0.625-10 micromol/L; (3) monoamine oxidase inhibitors (MAOIs)  such as moclobemide (MOC) 2.5-40 micromol/L] protected cells from the lesion induced by corticosterone. While antipsychotic drug chlorpromazine or anxiolytic agent diazepam 0.4-50 micromol/L had no such effect. Moreover  DIM 1  5 micromol/L or FLU 1  5 micromol/L attenuated the [Ca2+]i overload induced by corticosterone 0.1 mmol/L for 48 h in PC12 cells. Furthermore  treatment with DIM or FLU 10 micromol/L for 48 h elevated the NGF mRNA expression in PC12 cells.CONCLUSION: Despite a remarkable structural diversity  the cytoprotective effect can be viewed as the common action pathway of the antidepressants. Moreover  attenuation of the intracellular Ca2+ overload and elevation of neurotrophic factor (such as NGF) expression is one of the mechanisms of cytoprotective effect of antidepressants."
"26","12600706","Stress-induced vocalisation in adult animals. A valid model of anxiety?","The post-stimuli anticipatory vocalisations that follow stressful and painful conditions are suggested as a quantitative measure of the emotional state of fear and anxiety in animal models. Adult rats emit characteristic 22-kHz ultrasound vocalisations consisting of 20-30 kHz calls with a mean duration of 300-600 ms as response to aversive stimuli (e.g. inescapable electric footshock  acoustic or air-puff stimuli  agonistic encounter or withdrawal from treatment with drugs of abuse). The vocalisations are accompanied by defensive submissive behaviour and signal a refractory  socially withdrawn or helpless state. Furthermore  brain structures that are involved in the mediation of anxiety-like behaviour  e.g. the dorsal periaqueductal grey and cortical areas  are also important for modulation of ultrasonic vocalisation. Benzodiazepines  e.g. diazepam  inhibit shock-induced ultrasonic vocalisation although the active doses are generally close to those that produce sedation and muscle relaxation. Selective serotonin reuptake inhibitors and other antidepressants that preferentially enhance serotonergic neurotransmission inhibit footshock-induced ultrasonic vocalisation. The 5-HT(2) receptor antagonistic properties of fluoxetine may explain why only partial inhibition is achieved. The biphasic dose-response curve of the racemic drug  citalopram  may perhaps be ascribed to an attenuating effect of R-citalopram. Tricyclic antidepressants  e.g. imipramine  and antidepressants that preferentially enhance catecholaminergic neurotransmission  e.g. reboxetine and venlafaxine  are inactive. Classical antipsychotics like haloperidol have no or a weak inhibitory effect. Serotonin plays a major role in the mediation of ultrasonic vocalisation  and in particular 5-HT(1A) and 5-HT(2) receptors are found to have a prominent role. Different serotonergic pathways are likely to be involved in the mediation of the anxiolytic-like response  e.g. the pathway ascending from the dorsal raphe nucleus through the medial forebrain bundle to the amygdala and frontal cortex mediating conditioned/learned anxiety and another pathway ascending from the dorsal raphe nucleus to the periaqueductal grey mediating unconditioned/fight flight anxiety. Dopamine D(2) receptor agonists are potent inhibitors of footshock-induced ultrasonic vocalisation. The role of dopamine D(1) receptors and adrenoceptors remains to be further elucidated. Several other neurotransmitters are involved in the mediation of ultrasonic vocalisation  e.g. acetylcholine  histamine and glutamate. There is also a need for further studies of how changes in stress-axis function may modulate ultrasonic vocalisation and for studies of the effects of chronic drug treatment on ultrasonic vocalisation."
"27","12435798","Expression profile and up-regulation of PRAX-1 mRNA by antidepressant treatment in the rat brain.","A protein associated with the peripheral-type benzodiazepine receptor (PRAX-1) has recently been cloned  but its regional distribution in the central nervous system and its function remain to be clarified. In situ hybridization was carried out to localize PRAX-1 mRNA in the rat brain and revealed a high expression of the transcript in limbic structures such as the CA1 region of the hippocampus  as well as the dentate gyrus  septum  amygdala  and the islands of Calleja. A dense hybridization signal was also observed in the nucleus accumbens  caudate nucleus  olfactory tubercle  pineal gland  and cerebellar cortex. PRAX-1 mRNA expression was largely neuronal; it colocalized with neuron-specific enolase but not glial fibrillary acidic protein. Long-term treatments (21 days) with the neuroleptic haloperidol increased PRAX-1 mRNA expression only in the dentate gyrus  whereas anxiolytic/anticonvulsant diazepam had no effect in any of the hippocampal region studied. Repeated electroconvulsive shock administration significantly enhanced PRAX1 expression in the CA1 subfield and dentate gyrus. Several classes of antidepressant treatment  including serotonin selective reuptake inhibitor (fluoxetine)  mixed serotonin- and norepinephrine-uptake inhibitor (imipramine)  and monoamine oxidase inhibitors (iproniazid and tranylcypromine)  shared this effect. Furthermore  the selective nonpeptide NK2 receptor antagonist (S)-N-methyl-N-[4-acetylamino-4-phenylpiperidino)-2-(3 4-dichlorophenyl)butyl]benzamide (SR48968)  which shows an antidepressant profile in animal studies  also enhanced PRAX-1 mRNA expression. These results point to a potential role of PRAX-1 function in the central nervous system and suggest that the up-regulation of PRAX-1 mRNA represents a common action of chronic antidepressant treatment."
"28","12429386","Antipsychotic, antidepressant, anxiolytic, and anticonvulsant drugs induce type II nitric oxide synthase mRNA in rat brain.","Nitric oxide synthase inhibitors have been regarded as potentially beneficial for psychiatric disorders such as depression and schizophrenia  though little is known about how nitric oxide synthases are affected by psychotropic drugs in the brain. Using reverse transcription-polymerase chain reaction analysis  we investigated the effects of short- and long-term oral treatments with several psychotropics on type II nitric oxide synthase gene expression in the rat brain. With maprotiline and fluvoxamine  enzyme mRNA levels were higher after a 28 day treatment than after 1 and 4 day treatments. Zonisamide  carbamazepine and diazepam also increased mRNA  though differences in levels between 1  4 and 28 day treatments were not significant. These results suggest that psychotropics modulate the gene expression of type-II nitric oxide synthase in the brain."
